{
  "schemaVersion": "quizbible-runtime-v1",
  "generatedAt": "2026-08-21T00:00:00Z",
  "totalQuestions": 20,
  "questions": [
    {
      "id": "NQB-AT-GEN-0001",
      "testament": "OT",
      "book": "Génesis",
      "chapter": 1,
      "verseStart": 1,
      "verseEnd": 1,
      "referenceDisplay": "Génesis 1:1",
      "category": "AT_GENERAL",
      "subcategory": "Creación",
      "characters": [
        "Dios"
      ],
      "difficulty": "BASIC",
      "questionType": "MULTIPLE_CHOICE",
      "prompt": "¿Quién es presentado como creador de los cielos y la tierra al comienzo del relato bíblico?",
      "options": [
        {
          "id": "A",
          "text": "Dios"
        },
        {
          "id": "B",
          "text": "Adán"
        },
        {
          "id": "C",
          "text": "Noé"
        },
        {
          "id": "D",
          "text": "Abraham"
        }
      ],
      "correctOptionId": "A",
      "explanation": "El relato de Génesis comienza atribuyendo directamente a Dios la creación de los cielos y la tierra. La respuesta no depende de una interpretación posterior ni de identificar a un personaje humano: el propio inicio del libro establece quién realiza la acción creadora. Por eso, entre las alternativas propuestas, únicamente Dios corresponde al sujeto del acontecimiento.",
      "eligibleModes": [
        "AT",
        "AMBOS"
      ],
      "verificationTranslation": "RVR1960",
      "auditStatus": "VERIFIED",
      "humanReviewStatus": "PENDING"
    },
    {
      "id": "NQB-AT-GEN-0036",
      "testament": "OT",
      "book": "Génesis",
      "chapter": 10,
      "verseStart": 8,
      "verseEnd": 10,
      "referenceDisplay": "Génesis 10:8-10",
      "category": "PERSONAJES_BIBLICOS",
      "subcategory": "Nimrod",
      "characters": [
        "Nimrod"
      ],
      "difficulty": "ADVANCED",
      "questionType": "MULTIPLE_CHOICE",
      "prompt": "¿Qué personaje es presentado como poderoso en la tierra y tuvo a Babel entre los primeros centros de su reino?",
      "options": [
        {
          "id": "A",
          "text": "Nimrod"
        },
        {
          "id": "B",
          "text": "Peleg"
        },
        {
          "id": "C",
          "text": "Jafet"
        },
        {
          "id": "D",
          "text": "Canaán"
        }
      ],
      "correctOptionId": "A",
      "explanation": "La tabla de las naciones presenta a Nimrod como un personaje que comenzó a ser poderoso en la tierra y lo relaciona con varios centros de su reino en la tierra de Sinar, entre ellos Babel. Peleg, Jafet y Canaán aparecen también en las genealogías de Génesis, pero no reciben esta descripción ni son vinculados de esa manera con el comienzo de aquel reino.",
      "eligibleModes": [
        "AT",
        "AMBOS",
        "PERSONAJES_AT",
        "PERSONAJES_AMBOS"
      ],
      "verificationTranslation": "RVR1960",
      "auditStatus": "VERIFIED",
      "humanReviewStatus": "PENDING"
    },
    {
      "id": "NQB-AT-EXO-0002",
      "testament": "OT",
      "book": "Éxodo",
      "chapter": 1,
      "verseStart": 15,
      "verseEnd": 17,
      "referenceDisplay": "Éxodo 1:15-17",
      "category": "PERSONAJES_BIBLICOS",
      "subcategory": "Parteras hebreas",
      "characters": [
        "Sifra",
        "Fúa",
        "faraón"
      ],
      "difficulty": "ADVANCED",
      "questionType": "MULTIPLE_CHOICE",
      "prompt": "¿Cómo se llamaban las dos parteras hebreas a quienes el faraón ordenó matar a los niños varones al nacer?",
      "options": [
        {
          "id": "A",
          "text": "Sifra y Fúa"
        },
        {
          "id": "B",
          "text": "Bilha y Zilpa"
        },
        {
          "id": "C",
          "text": "Miriam y Séfora"
        },
        {
          "id": "D",
          "text": "Lea y Raquel"
        }
      ],
      "correctOptionId": "A",
      "explanation": "Éxodo identifica por nombre a Sifra y Fúa como las parteras hebreas que recibieron la orden del faraón. Ellas temieron a Dios y no cumplieron la instrucción de matar a los niños varones. La pregunta exige recordar dos nombres secundarios concretos, por lo que se clasifica como avanzada.",
      "eligibleModes": [
        "AT",
        "AMBOS",
        "PERSONAJES_AT",
        "PERSONAJES_AMBOS"
      ],
      "verificationTranslation": "RVR1960",
      "auditStatus": "VERIFIED",
      "humanReviewStatus": "PENDING"
    },
    {
      "id": "NQB-AT-EXO-0021",
      "testament": "OT",
      "book": "Éxodo",
      "chapter": 9,
      "verseStart": 3,
      "verseEnd": 6,
      "referenceDisplay": "Éxodo 9:3-6",
      "category": "AT_GENERAL",
      "subcategory": "Plaga sobre el ganado",
      "characters": [
        "Moisés",
        "faraón",
        "egipcios",
        "israelitas"
      ],
      "difficulty": "INTERMEDIATE",
      "questionType": "MULTIPLE_CHOICE",
      "prompt": "¿Qué ocurrió con el ganado de los egipcios durante la plaga anunciada sobre sus animales?",
      "options": [
        {
          "id": "A",
          "text": "Una mortandad afectó al ganado de los egipcios, mientras el de Israel fue preservado"
        },
        {
          "id": "B",
          "text": "Todo el ganado de Egipto y de Israel murió por igual"
        },
        {
          "id": "C",
          "text": "El ganado fue trasladado al desierto antes de la plaga"
        },
        {
          "id": "D",
          "text": "Los animales egipcios fueron entregados a los israelitas"
        }
      ],
      "correctOptionId": "A",
      "explanation": "La plaga sobre el ganado marcó una nueva distinción entre los egipcios y los israelitas. El relato describe una mortandad severa entre los animales de Egipto, mientras señala que el ganado perteneciente a Israel fue preservado. La pregunta evalúa precisamente ese contraste dentro de la secuencia de las plagas.",
      "eligibleModes": [
        "AT",
        "AMBOS"
      ],
      "verificationTranslation": "RVR1960",
      "auditStatus": "VERIFIED",
      "humanReviewStatus": "PENDING"
    },
    {
      "id": "NQB-AT-LEV-0017",
      "testament": "OT",
      "book": "Levítico",
      "chapter": 7,
      "verseStart": 26,
      "verseEnd": 27,
      "referenceDisplay": "Levítico 7:26-27",
      "category": "AT_GENERAL",
      "subcategory": "Prohibición de consumir sangre",
      "characters": [
        "israelitas"
      ],
      "difficulty": "BASIC",
      "questionType": "MULTIPLE_CHOICE",
      "prompt": "¿Qué estaba prohibido consumir en cualquier lugar donde habitaran los israelitas, tanto de aves como de otros animales?",
      "options": [
        {
          "id": "A",
          "text": "Sangre"
        },
        {
          "id": "B",
          "text": "Leche"
        },
        {
          "id": "C",
          "text": "Aceite"
        },
        {
          "id": "D",
          "text": "Agua"
        }
      ],
      "correctOptionId": "A",
      "explanation": "La norma prohíbe consumir sangre y amplía la referencia tanto a aves como a otros animales. La pregunta se limita a identificar el elemento expresamente prohibido en este pasaje.",
      "eligibleModes": [
        "AT",
        "AMBOS"
      ],
      "verificationTranslation": "RVR1960",
      "auditStatus": "VERIFIED",
      "humanReviewStatus": "PENDING"
    },
    {
      "id": "NQB-AT-LEV-0045",
      "testament": "OT",
      "book": "Levítico",
      "chapter": 18,
      "verseStart": 5,
      "verseEnd": 5,
      "referenceDisplay": "Levítico 18:5",
      "category": "AT_GENERAL",
      "subcategory": "Guardar estatutos y ordenanzas",
      "characters": [
        "israelitas"
      ],
      "difficulty": "ADVANCED",
      "questionType": "MULTIPLE_CHOICE",
      "prompt": "¿Qué resultado se asocia en esta instrucción con poner por obra los estatutos y ordenanzas?",
      "options": [
        {
          "id": "A",
          "text": "Vivir por medio de ellos"
        },
        {
          "id": "B",
          "text": "Recibir una función sacerdotal"
        },
        {
          "id": "C",
          "text": "Quedar exento de ofrecer sacrificios"
        },
        {
          "id": "D",
          "text": "Obtener tierras adicionales"
        }
      ],
      "correctOptionId": "A",
      "explanation": "El pasaje conecta la obediencia a los estatutos y ordenanzas con la vida. La pregunta evalúa esa relación directa expresada en la norma, sin extenderla a recompensas materiales o funciones que el versículo no menciona.",
      "eligibleModes": [
        "AT",
        "AMBOS"
      ],
      "verificationTranslation": "RVR1960",
      "auditStatus": "VERIFIED",
      "humanReviewStatus": "PENDING"
    },
    {
      "id": "NQB-AT-NUM-0001",
      "testament": "OT",
      "book": "Números",
      "chapter": 1,
      "verseStart": 2,
      "verseEnd": 3,
      "referenceDisplay": "Números 1:2-3",
      "category": "AT_GENERAL",
      "subcategory": "Censo militar de Israel",
      "characters": [
        "Moisés",
        "Aarón",
        "israelitas"
      ],
      "difficulty": "INTERMEDIATE",
      "questionType": "MULTIPLE_CHOICE",
      "prompt": "¿A partir de qué edad debían contarse para el ejército los varones de Israel en el censo del desierto?",
      "options": [
        {
          "id": "A",
          "text": "Veinte años"
        },
        {
          "id": "B",
          "text": "Veinticinco años"
        },
        {
          "id": "C",
          "text": "Treinta años"
        },
        {
          "id": "D",
          "text": "Cuarenta años"
        }
      ],
      "correctOptionId": "A",
      "explanation": "El censo militar incluía a los varones de veinte años en adelante que estuvieran en condiciones de salir a la guerra. La pregunta evalúa el umbral de edad establecido para esta cuenta, no el total resultante de cada tribu.",
      "eligibleModes": [
        "AT",
        "AMBOS"
      ],